{
  "schemaVersion": 1,
  "id": "9b23df52-214c-4051-9f11-ff20345517d7",
  "number": "ПРИМЕР-002",
  "title": "Курьерский пакет, БЕЛЫЙ, 500x600+40, 45 мкм",
  "plan": 20000,
  "priority": 0,
  "dueAt": null,
  "spec": {
    "id": "ТЗ-ПРИМЕР-002",
    "revision": "1",
    "approvedBy": "Касаткин А.С.",
    "approvedAt": "2026-10-19",
    "inputs": {
      "channel": "МП",
      "client": "МП (маркетплейс)",
      "manager": "",
      "phone": "",
      "tirage": 20000,
      "tzno": "ТЗ-ПРИМЕР-002",
      "approver": "Касаткин А.С.",
      "approveDate": "2026-10-19",
      "product": "Курьерский пакет",
      "color": "БЕЛЫЙ",
      "A": 500,
      "B": 600,
      "C": 40,
      "t": 45,
      "pocket": "нет",
      "hasHole": false,
      "holeY": "снизу",
      "E": null,
      "holeX": "от левого края",
      "F": null,
      "hasPrint": false,
      "printType": "",
      "printAlign": "по центру",
      "printSide": "лицевая",
      "G": null,
      "H": null,
      "I": null,
      "K": null,
      "linerType": "Металлизированный",
      "linerW": 20,
      "strip": 8,
      "stack": 100,
      "stacks": 10,
      "stackPack": "брак КП",
      "seal": true,
      "stackLabel": false,
      "labelTpl": "MP",
      "labelName": "Курьерский пакет",
      "labelMain": "с торца",
      "labelExtra": "нет",
      "boxL": 66,
      "boxW": 52,
      "boxH": 30,
      "palBoxes": null,
      "palL": 120,
      "palW": 80,
      "palH": 15,
      "palKg": 25,
      "maxKg": 600,
      "maxH": 160,
      "overhang": true,
      "wrap": "стрейч-плёнка 500 мм",
      "wrapLayers": 3,
      "wrapBottom": true,
      "corners": false,
      "other": "Контроль качества — по Регламенту 4.2, весовой контроль — по Регламенту 4.3, приёмка — по Регламенту 4.4."
    },
    "settings": {
      "channels": {
        "МП": {
          "valve": 130,
          "strip": 8,
          "linerW": 20,
          "linerT": 20,
          "ncMin": 0.95,
          "ncMax": 1.05,
          "cMin": 0.9,
          "cMax": 1.1
        },
        "OZON": {
          "valve": 130,
          "strip": 8,
          "linerW": 20,
          "linerT": 20,
          "ncMin": 0.95,
          "ncMax": 1.05,
          "cMin": 0.9,
          "cMax": 1.1
        },
        "ВБК": {
          "valve": 130,
          "strip": 8,
          "linerW": 20,
          "linerT": 20,
          "ncMin": 0.92,
          "ncMax": 1.05,
          "cMin": 0.92,
          "cMax": 1.1
        },
        "СДЭК": {
          "valve": 130,
          "strip": 20,
          "linerW": 25,
          "linerT": 20,
          "ncMin": 0.95,
          "ncMax": 1.05,
          "cMin": 0.9,
          "cMax": 1.1
        },
        "Спортмастер": {
          "valve": 130,
          "strip": 8,
          "linerW": 20,
          "linerT": 20,
          "ncMin": 0.95,
          "ncMax": 1.05,
          "cMin": 0.9,
          "cMax": 1.1
        },
        "СДТ": {
          "valve": 130,
          "strip": 8,
          "linerW": 20,
          "linerT": 20,
          "ncMin": 0.95,
          "ncMax": 1.05,
          "cMin": 0.9,
          "cMax": 1.1
        },
        "ПЕГАС": {
          "valve": 0,
          "strip": 0,
          "linerW": 5,
          "linerT": 44,
          "ncMin": 0.95,
          "ncMax": 1.05,
          "cMin": 0.9,
          "cMax": 1.1
        },
        "БТК": {
          "valve": 0,
          "strip": 0,
          "linerW": 5,
          "linerT": 44,
          "ncMin": 0.95,
          "ncMax": 1.05,
          "cMin": 0.9,
          "cMax": 1.1
        },
        "ВБК_СЕЙФ": {
          "valve": 0,
          "strip": 0,
          "linerW": 30,
          "linerT": 85,
          "ncMin": 0.95,
          "ncMax": 1.05,
          "cMin": 0.95,
          "cMax": 1.1
        }
      },
      "film": {
        "БЕЛЫЙ": 0.96,
        "ЧЁРНЫЙ": 0.96,
        "ПРОЗРАЧНЫЙ": 0.92,
        "ФЛЕКСОГРАФИЯ": 0.96
      },
      "liner": {
        "Металлизированный": 1.38,
        "Прозрачный": 1.38,
        "Многоразовый": 1.37
      },
      "glue": {
        "Клей-расплав": 0.98
      },
      "board": {
        "Гофрокартон Т-23/Т-24, кг/м²": 0.5
      }
    },
    "computed": {
      "notes": [
        [
          "ok",
          "Паллету ограничивает высота: 4 яруса по 2 короба, по весу вошло бы 10."
        ],
        [
          "ok",
          "Однородная укладка: швы ярусов совпадают, устойчивость держится на обмотке с подмоткой к низу паллеты."
        ],
        [
          "warn",
          "Ярус заполнен на 65 % площади. Возможно, стоит подобрать другой короб."
        ]
      ],
      "bag": {
        "film": 26.783999999999995,
        "liner": 0.27599999999999997,
        "glue": 0.2548,
        "total": 27.314799999999995,
        "ch": {
          "valve": 130,
          "strip": 8,
          "linerW": 20,
          "linerT": 20,
          "ncMin": 0.95,
          "ncMax": 1.05,
          "cMin": 0.9,
          "cMax": 1.1
        }
      },
      "perBox": 1000,
      "ch": {
        "valve": 130,
        "strip": 8,
        "linerW": 20,
        "linerT": 20,
        "ncMin": 0.95,
        "ncMax": 1.05,
        "cMin": 0.9,
        "cMax": 1.1
      },
      "pack": 2.7314799999999995,
      "zone": {
        "S": 2.458,
        "Q": 2.595,
        "R": 2.868,
        "T": 3.005
      },
      "tare": 0.98195,
      "gross": 28.569897999999995,
      "fold": {
        "fa": 1,
        "fb": 1,
        "len": 640,
        "A": 500,
        "m": 1
      },
      "fit": {
        "cols": 1,
        "avgStack": 11,
        "rot": false,
        "nx": 1,
        "ny": 1,
        "need": 110,
        "perCol": 10
      },
      "lay": {
        "A": {
          "type": "A",
          "total": 1,
          "groups": [
            {
              "x": 0,
              "y": 0,
              "zw": 126,
              "zh": 86,
              "w": 66.6,
              "h": 52.6,
              "nx": 1,
              "ny": 1,
              "o": "A"
            }
          ]
        },
        "B": {
          "type": "B",
          "total": 2,
          "groups": [
            {
              "x": 0,
              "y": 0,
              "zw": 126,
              "zh": 86,
              "w": 52.6,
              "h": 66.6,
              "nx": 2,
              "ny": 1,
              "o": "B"
            }
          ]
        },
        "M": {
          "type": "V",
          "split": 66.6,
          "total": 2,
          "groups": [
            {
              "x": 0,
              "y": 0,
              "zw": 66.6,
              "zh": 86,
              "w": 66.6,
              "h": 52.6,
              "nx": 1,
              "ny": 1,
              "o": "A"
            },
            {
              "x": 66.6,
              "y": 0,
              "zw": 59.400000000000006,
              "zh": 86,
              "w": 52.6,
              "h": 66.6,
              "nx": 1,
              "ny": 1,
              "o": "B"
            }
          ]
        },
        "best": {
          "type": "B",
          "total": 2,
          "groups": [
            {
              "x": 0,
              "y": 0,
              "zw": 126,
              "zh": 86,
              "w": 52.6,
              "h": 66.6,
              "nx": 2,
              "ny": 1,
              "o": "B"
            }
          ]
        }
      },
      "eff": {
        "L": 126,
        "W": 86,
        "ov": 6,
        "bl": 66.6,
        "bw": 52.6,
        "bh": 30.6
      },
      "perLayer": 2,
      "layers": 4,
      "limit": "высота",
      "lH": 4,
      "lW": 10,
      "autoBoxes": 8,
      "boxes": 8,
      "manual": false,
      "pcs": 8000,
      "palKg": 253.55918399999996,
      "palH": 137.4,
      "mixed": false,
      "fill": 64.65780730897009,
      "tirBoxes": 20,
      "tirPal": 3,
      "stack": 100
    },
    "display": {
      "mat": [
        [
          "Цвет плёнки",
          "БЕЛЫЙ"
        ],
        [
          "Толщина плёнки",
          "45 мкм"
        ],
        [
          "Тип лайнера",
          "Металлизированный"
        ],
        [
          "Ширина лайнера",
          "20 мм"
        ],
        [
          "Клеевая полоса",
          "8 мм"
        ],
        [
          "Карман",
          "нет"
        ],
        [
          "Изображение",
          "нет"
        ],
        [
          "Тех. отверстие",
          "нет"
        ]
      ],
      "pack": [
        [
          "Фасовка в стопке",
          "100 шт"
        ],
        [
          "Упаковка стопок",
          "брак КП, запечатать"
        ],
        [
          "Этикетка на стопке",
          "нет"
        ],
        [
          "Стопок в коробе",
          "10"
        ],
        [
          "Всего в коробе",
          "1 000 шт"
        ],
        [
          "Гофрокороб (внутр.)",
          "66 × 52 × 30 см"
        ],
        [
          "Этикетка на короб",
          "«МП (стандарт)», с торца короба, по центру"
        ],
        [
          "Доп. этикетка",
          "нет"
        ]
      ],
      "pal": [
        [
          "Поддон",
          "1200 × 800 × 150 мм"
        ],
        [
          "Свес коробов",
          "до 3 см на сторону"
        ],
        [
          "Укладка яруса",
          "2 короба: 2 × 1, длинная сторона короба поперёк поддона"
        ],
        [
          "Ярусов",
          "4"
        ],
        [
          "Коробов на паллете",
          "8"
        ],
        [
          "Пакетов на паллете",
          "8 000"
        ],
        [
          "Брутто короба (расч.)",
          "≈ 28,57 кг"
        ],
        [
          "Паллета (расч.)",
          "≈ 254 кг, ≈ 137 см"
        ],
        [
          "Ограничения",
          "не более 600 кг и 160 см"
        ],
        [
          "Обмотка",
          "стрейч-плёнка 500 мм, 3 слоя, с подмоткой к низу паллеты"
        ],
        [
          "Уголки",
          "нет"
        ],
        [
          "На тираж",